{
  "schemaVersion": 1,
  "id": "inc-example",
  "title": "Example structural incident",
  "status": "open",
  "severity": "medium",
  "detectedBy": "manager",
  "managerJobIds": [
    "general-manager"
  ],
  "relatedWorkItemIds": [],
  "symptom": "A reusable part of the operating system behaved incorrectly.",
  "rootCause": null,
  "fix": null,
  "regressionCheck": null,
  "prevention": null,
  "operatingModelChanged": false,
  "githubIssue": null,
  "openedAt": "2026-09-27T00:00:00.000Z",
  "resolvedAt": null
}
